{
  "channels": 1,
  "codec": "pcm_s16le",
  "coverage": {
    "end_ticks": 180000,
    "start_ticks": 0
  },
  "duration_ticks": 180000,
  "file": "audio.wav",
  "sample_count": 32000,
  "sample_rate": 16000,
  "schema_version": "clipmill.media.audio.v1",
  "source_fingerprint": "sha256:31ab000000000000000000000000000000000000000000000000000000000006"
}
